{
  "generatedAt": "2026-05-25T07:21:31.988Z",
  "registryName": "meta-kim-capabilities",
  "scope": "repo-canonical",
  "canonicalProjection": "config/capability-index/meta-kim-capabilities.json",
  "canonicalSource": "config/capability-index/meta-kim-capabilities.json",
  "localGlobalInventory": ".meta-kim/state/{profile}/capability-index/global-capabilities.json",
  "mirroredTo": [
    ".claude/capability-index/meta-kim-capabilities.json",
    ".codex/capability-index/meta-kim-capabilities.json",
    "openclaw/capability-index/meta-kim-capabilities.json",
    ".cursor/capability-index/meta-kim-capabilities.json"
  ],
  "fetchOrder": [
    "repo canonical capability index",
    "runtime mirror",
    "local global inventory",
    "fallback general agent with capability gap record"
  ],
  "summary": {
    "totalAgents": 9,
    "totalSkills": 7,
    "totalHooks": 22,
    "totalMcpServers": 1,
    "totalMcpTools": 3,
    "totalPlugins": 0,
    "totalCommands": 2
  },
  "abstractCapabilitySlots": [
    {
      "slotId": "run-scoped-meta-skill-selection",
      "description": "Abstract slot for selecting concrete child skills at runtime Fetch without binding them into long-term meta-agent identity.",
      "allowedProviderIds": [
        "meta-theory",
        "agent-teams-playbook",
        "superpowers",
        "ecc",
        "findskill"
      ],
      "selectedSkillScope": "run_only"
    },
    {
      "slotId": "interface-integration-contract",
      "description": "Abstract slot for internal API and third-party provider integration work: evidence-backed field ledger, provider adapter boundary, auth/signature, idempotency, callback, error model, contract tests, observability, and rollback gates.",
      "allowedProviderIds": [
        "meta-theory",
        "agent-teams-playbook",
        "superpowers",
        "ecc",
        "findskill"
      ],
      "selectedSkillScope": "run_only"
    }
  ],
  "metaSkillProviders": {
    "meta-theory": {
      "id": "meta-theory",
      "providerKind": "meta-skill-package",
      "allowedForLongTermAgentIdentity": true,
      "concreteSubSkillBindingForbidden": true,
      "notes": "May be referenced as a long-term provider package; concrete child skills are selected per run during Fetch."
    },
    "agent-teams-playbook": {
      "id": "agent-teams-playbook",
      "providerKind": "meta-skill-package",
      "allowedForLongTermAgentIdentity": true,
      "concreteSubSkillBindingForbidden": true,
      "notes": "May be referenced as a long-term provider package; concrete child skills are selected per run during Fetch."
    },
    "superpowers": {
      "id": "superpowers",
      "providerKind": "meta-skill-package",
      "allowedForLongTermAgentIdentity": true,
      "concreteSubSkillBindingForbidden": true,
      "notes": "May be referenced as a long-term provider package; concrete child skills are selected per run during Fetch."
    },
    "ecc": {
      "id": "ecc",
      "providerKind": "meta-skill-package",
      "allowedForLongTermAgentIdentity": true,
      "concreteSubSkillBindingForbidden": true,
      "notes": "May be referenced as a long-term provider package; concrete child skills are selected per run during Fetch."
    },
    "findskill": {
      "id": "findskill",
      "providerKind": "meta-skill-package",
      "allowedForLongTermAgentIdentity": true,
      "concreteSubSkillBindingForbidden": true,
      "notes": "May be referenced as a long-term provider package; concrete child skills are selected per run during Fetch."
    }
  },
  "runtimeSelectedSkills": {
    "selectedSkillScope": "run_only",
    "persistencePolicy": "Runtime-selected concrete skills are scoped to the current run and must not be persisted into long-term agent identity."
  },
  "longTermAgentIdentityPolicy": {
    "forbidConcreteSkillInLongTermAgentIdentity": true,
    "allowedMetaSkillProviderIds": [
      "meta-theory",
      "agent-teams-playbook",
      "superpowers",
      "ecc",
      "findskill"
    ],
    "forbiddenConcreteSkillPatterns": [
      "provider/*",
      "provider:child-skill",
      "runtime-specific child skill id"
    ]
  },
  "byCapabilityType": {
    "agents": {
      "repo:canonical:meta-artisan": {
        "id": "meta-artisan",
        "type": "agents",
        "namespace": "canonical",
        "path": "canonical/agents/meta-artisan.md",
        "size": 16475,
        "modified": "2026-05-24T17:16:25.691Z",
        "layer": "meta",
        "executionBlock": true
      },
      "repo:canonical:meta-chrysalis": {
        "id": "meta-chrysalis",
        "type": "agents",
        "namespace": "canonical",
        "path": "canonical/agents/meta-chrysalis.md",
        "size": 28910,
        "modified": "2026-05-24T17:15:49.593Z",
        "layer": "meta",
        "executionBlock": true
      },
      "repo:canonical:meta-conductor": {
        "id": "meta-conductor",
        "type": "agents",
        "namespace": "canonical",
        "path": "canonical/agents/meta-conductor.md",
        "size": 50971,
        "modified": "2026-05-24T17:24:59.881Z",
        "layer": "meta",
        "executionBlock": true
      },
      "repo:canonical:meta-genesis": {
        "id": "meta-genesis",
        "type": "agents",
        "namespace": "canonical",
        "path": "canonical/agents/meta-genesis.md",
        "size": 19927,
        "modified": "2026-05-24T17:15:58.109Z",
        "layer": "meta",
        "executionBlock": true
      },
      "repo:canonical:meta-librarian": {
        "id": "meta-librarian",
        "type": "agents",
        "namespace": "canonical",
        "path": "canonical/agents/meta-librarian.md",
        "size": 19981,
        "modified": "2026-05-24T17:09:39.648Z",
        "layer": "meta",
        "executionBlock": true
      },
      "repo:canonical:meta-prism": {
        "id": "meta-prism",
        "type": "agents",
        "namespace": "canonical",
        "path": "canonical/agents/meta-prism.md",
        "size": 27955,
        "modified": "2026-05-24T17:16:05.106Z",
        "layer": "meta",
        "executionBlock": true
      },
      "repo:canonical:meta-scout": {
        "id": "meta-scout",
        "type": "agents",
        "namespace": "canonical",
        "path": "canonical/agents/meta-scout.md",
        "size": 17628,
        "modified": "2026-05-24T17:09:39.652Z",
        "layer": "meta",
        "executionBlock": true
      },
      "repo:canonical:meta-sentinel": {
        "id": "meta-sentinel",
        "type": "agents",
        "namespace": "canonical",
        "path": "canonical/agents/meta-sentinel.md",
        "size": 18736,
        "modified": "2026-05-24T17:09:39.653Z",
        "layer": "meta",
        "executionBlock": true
      },
      "repo:canonical:meta-warden": {
        "id": "meta-warden",
        "type": "agents",
        "namespace": "canonical",
        "path": "canonical/agents/meta-warden.md",
        "size": 33626,
        "modified": "2026-05-24T17:16:13.324Z",
        "layer": "meta",
        "executionBlock": true
      }
    },
    "skills": {
      "repo:canonical:meta-theory": {
        "id": "meta-theory",
        "type": "skills",
        "namespace": "canonical",
        "path": "canonical/skills/meta-theory/SKILL.md",
        "size": 72877,
        "modified": "2026-05-25T07:17:28.468Z"
      },
      "repo:canonical-reference:create-agent": {
        "id": "create-agent",
        "type": "skills",
        "namespace": "canonical-reference",
        "path": "canonical/skills/meta-theory/references/create-agent.md",
        "relativePath": "create-agent.md",
        "size": 19283,
        "modified": "2026-05-24T17:25:30.417Z"
      },
      "repo:canonical-reference:dev-governance": {
        "id": "dev-governance",
        "type": "skills",
        "namespace": "canonical-reference",
        "path": "canonical/skills/meta-theory/references/dev-governance.md",
        "relativePath": "dev-governance.md",
        "size": 115783,
        "modified": "2026-05-24T17:25:11.963Z"
      },
      "repo:canonical-reference:intent-amplification": {
        "id": "intent-amplification",
        "type": "skills",
        "namespace": "canonical-reference",
        "path": "canonical/skills/meta-theory/references/intent-amplification.md",
        "relativePath": "intent-amplification.md",
        "size": 6660,
        "modified": "2026-04-30T04:49:01.616Z"
      },
      "repo:canonical-reference:meta-theory": {
        "id": "meta-theory",
        "type": "skills",
        "namespace": "canonical-reference",
        "path": "canonical/skills/meta-theory/references/meta-theory.md",
        "relativePath": "meta-theory.md",
        "size": 17586,
        "modified": "2026-05-20T07:36:52.209Z"
      },
      "repo:canonical-reference:rhythm-orchestration": {
        "id": "rhythm-orchestration",
        "type": "skills",
        "namespace": "canonical-reference",
        "path": "canonical/skills/meta-theory/references/rhythm-orchestration.md",
        "relativePath": "rhythm-orchestration.md",
        "size": 8165,
        "modified": "2026-05-21T18:48:57.611Z"
      },
      "repo:canonical-reference:ten-step-governance": {
        "id": "ten-step-governance",
        "type": "skills",
        "namespace": "canonical-reference",
        "path": "canonical/skills/meta-theory/references/ten-step-governance.md",
        "relativePath": "ten-step-governance.md",
        "size": 10332,
        "modified": "2026-05-21T18:49:00.678Z"
      }
    },
    "hooks": {
      "repo:canonical-runtime-assets:activate-meta-theory-spine.mjs": {
        "id": "activate-meta-theory-spine.mjs",
        "type": "hooks",
        "namespace": "canonical-runtime-assets",
        "path": "canonical/runtime-assets/shared/hooks/activate-meta-theory-spine.mjs",
        "relativePath": "activate-meta-theory-spine.mjs",
        "size": 916,
        "modified": "2026-05-19T08:57:26.859Z"
      },
      "repo:canonical-runtime-assets:hook-i18n.mjs": {